Enter password: ****
Welcome to the MySQL monitor.  Commands end with ; or \g.
Your MySQL connection id is 8
Server version: 8.0.40 MySQL Community Server - GPL

Copyright (c) 2000, 2024, Oracle and/or its affiliates.

Oracle is a registered trademark of Oracle Corporation and/or its
affiliates. Other names may be trademarks of their respective
owners.

Type 'help;' or '\h' for help. Type '\c' to clear the current input statement.

mysql> create database second_revision
    -> ;
Query OK, 1 row affected (0.10 sec)

mysql> delimiter
ERROR:
DELIMITER must be followed by a 'delimiter' character or string
mysql> use second_revision;
Database changed
mysql> create table doctor(id int(5) primary key auti_
increment,name varchar(200) not null,email varchar(200
)not null unique,contact varchar(200) not null unique,Bdegree varchar(200) not null,age int (5) not null,salary int(5) Default 50000);
ERROR 1064 (42000): You have an error in your SQL syntax; check the manual that corresponds to your MySQL server version for the right syntax to use near 'auti_increment,name varchar(200) not null,email varchar(200)not null unicreate table doctor(id int(5) primary key auti_
ot null unique,contact varchar(200) not null unique,Bdincrement,name varchar(200) not null,email varchar(200)nint(5) Default 50000); varchar(200) not null unique,Bdegree varchar(200) not null,age int (5) not null,salary
ERROR 1064 (42000): You have an error in your SQL syntax; check the manual that corresponds to your MySQL server version for the right syntax to use near 'auti_increment,name varchar(200) not null,email varchar(200)not null unique,cont' at line 1
mysql>
mysql>
mysql>
mysql> create table doctor(id int(5) primary key auti_increment,name varchar(200) not null,email varchar(200)not null unique,contact varchar(200) not null unique,Bdegree varchar(200) not null,age int (5) not null,salary int(5) Default 50000);
ERROR 1064 (42000): You have an error in your SQL syntax; check the manual that corresponds to your MySQL server version for the right syntax to use near 'auti_increment,name varchar(200) not null,email varchar(200)not null unique,cont' at line 1
mysql>
mysql>
mysql> create table doctor(id int(5) primary key auto_increment,name varchar(200) not null,email varchar(200)not null unique,contact varchar(200) not null unique,Bdegree varchar(200) not null,age int (5) not null,salary int(5) Default 50000);
Query OK, 0 rows affected, 3 warnings (0.11 sec)

mysql> disc doctor;
ERROR 1064 (42000): You have an error in your SQL syntax; check the manual that corresponds to your MySQL server version for the right syntax to use near 'disc doctor' at line 1
mysql> disc table doctor;
ERROR 1064 (42000): You have an error in your SQL syntax; check the manual that corresponds to your MySQL server version for the right syntax to use near 'disc table doctor' at line 1
mysql>
mysql>
mysql> desc doctor
    -> ;
+---------+--------------+------+-----+---------+----------------+
| Field   | Type         | Null | Key | Default | Extra          |
+---------+--------------+------+-----+---------+----------------+
| id      | int          | NO   | PRI | NULL    | auto_increment |
| name    | varchar(200) | NO   |     | NULL    |                |
| email   | varchar(200) | NO   | UNI | NULL    |                |
| contact | varchar(200) | NO   | UNI | NULL    |                |
| Bdegree | varchar(200) | NO   |     | NULL    |                |
| age     | int          | NO   |     | NULL    |                |
| salary  | int          | YES  |     | 50000   |                |
+---------+--------------+------+-----+---------+----------------+
7 rows in set (0.04 sec)

mysql> insert into doctor value ('0','PARAG','parag@gmail.com','6424687248','MBBS',32);
ERROR 1136 (21S01): Column count doesn't match value count at row 1
mysql> insert into doctor value ('0','PARAG','parag@gmail.com','6424687248','MBBS',32,'0');
Query OK, 1 row affected (0.01 sec)

mysql> select * from doctor;
+----+-------+-----------------+------------+---------+-----+--------+
| id | name  | email           | contact    | Bdegree | age | salary |
+----+-------+-----------------+------------+---------+-----+--------+
|  1 | PARAG | parag@gmail.com | 6424687248 | MBBS    |  32 |      0 |
+----+-------+-----------------+------------+---------+-----+--------+
1 row in set (0.00 sec)

mysql> drop table doctor;
Query OK, 0 rows affected (0.04 sec)

mysql> create table doctor(id int(5) primary key auto_increment,name varchar(200) not null,email varchar(200)not null unique,contact varchar(200) not null unique,Bdegree varchar(200) not null,age int (5) not null,salary int(5));
Query OK, 0 rows affected, 3 warnings (0.08 sec)

mysql> insert into doctor value ('0','PARAG','parag@gmail.com','6424687248','MBBS',32,10000);
Query OK, 1 row affected (0.01 sec)

mysql> select * from doctor;
+----+-------+-----------------+------------+---------+-----+--------+
| id | name  | email           | contact    | Bdegree | age | salary |
+----+-------+-----------------+------------+---------+-----+--------+
|  1 | PARAG | parag@gmail.com | 6424687248 | MBBS    |  32 |  10000 |
+----+-------+-----------------+------------+---------+-----+--------+
1 row in set (0.00 sec)

mysql> insert into doctor value ('0','Anagha','Anagha@gmail.com','6424675248','BHMS',28,10000);
Query OK, 1 row affected (0.01 sec)

mysql> insert into doctor value ('0','Rizwan','Rizwan@gmail.com','9824675248','BAMS',35,50000);
Query OK, 1 row affected (0.01 sec)

mysql> insert into doctor value ('0','Ishvari','Ishvari@gmail.com','9824675890','MBBS',34,60000);
Query OK, 1 row affected (0.01 sec)

mysql> insert into doctor value ('0','Radhika','Radhika@gmail.com','9823675890','MBBS',29,10000);
Query OK, 1 row affected (0.01 sec)

mysql> insert into doctor value ('0','Yash','Yash@gmail.com','9823675340','BHMS',27,10000);
Query OK, 1 row affected (0.00 sec)

mysql> insert into doctor value ('0','Avni','Avni@gmail.com','9813675340','MBBS',33,10000);
Query OK, 1 row affected (0.01 sec)

mysql> insert into doctor value ('0','Mahesh','Mahesh@gmail.com','6348934240','BHMS',39,70000);
Query OK, 1 row affected (0.01 sec)

mysql> select * from doctor;
+----+---------+-------------------+------------+---------+-----+--------+
| id | name    | email             | contact    | Bdegree | age | salary |
+----+---------+-------------------+------------+---------+-----+--------+
|  1 | PARAG   | parag@gmail.com   | 6424687248 | MBBS    |  32 |  10000 |
|  2 | Anagha  | Anagha@gmail.com  | 6424675248 | BHMS    |  28 |  10000 |
|  3 | Rizwan  | Rizwan@gmail.com  | 9824675248 | BAMS    |  35 |  50000 |
|  4 | Ishvari | Ishvari@gmail.com | 9824675890 | MBBS    |  34 |  60000 |
|  5 | Radhika | Radhika@gmail.com | 9823675890 | MBBS    |  29 |  10000 |
|  6 | Yash    | Yash@gmail.com    | 9823675340 | BHMS    |  27 |  10000 |
|  7 | Avni    | Avni@gmail.com    | 9813675340 | MBBS    |  33 |  10000 |
|  8 | Mahesh  | Mahesh@gmail.com  | 6348934240 | BHMS    |  39 |  70000 |
+----+---------+-------------------+------------+---------+-----+--------+
8 rows in set (0.00 sec)

mysql> insert into doctor value ('0','Ritika','Ritika@gmail.com','6348934640','BHMS',49,30000);
Query OK, 1 row affected (0.01 sec)

mysql> insert into doctor value ('0','Anushka','Anushka@gmail.com','6348534640','BHMS',26,20000);
Query OK, 1 row affected (0.01 sec)

mysql> select * from doctor;
+----+---------+-------------------+------------+---------+-----+--------+
| id | name    | email             | contact    | Bdegree | age | salary |
+----+---------+-------------------+------------+---------+-----+--------+
|  1 | PARAG   | parag@gmail.com   | 6424687248 | MBBS    |  32 |  10000 |
|  2 | Anagha  | Anagha@gmail.com  | 6424675248 | BHMS    |  28 |  10000 |
|  3 | Rizwan  | Rizwan@gmail.com  | 9824675248 | BAMS    |  35 |  50000 |
|  4 | Ishvari | Ishvari@gmail.com | 9824675890 | MBBS    |  34 |  60000 |
|  5 | Radhika | Radhika@gmail.com | 9823675890 | MBBS    |  29 |  10000 |
|  6 | Yash    | Yash@gmail.com    | 9823675340 | BHMS    |  27 |  10000 |
|  7 | Avni    | Avni@gmail.com    | 9813675340 | MBBS    |  33 |  10000 |
|  8 | Mahesh  | Mahesh@gmail.com  | 6348934240 | BHMS    |  39 |  70000 |
|  9 | Ritika  | Ritika@gmail.com  | 6348934640 | BHMS    |  49 |  30000 |
| 10 | Anushka | Anushka@gmail.com | 6348534640 | BHMS    |  26 |  20000 |
+----+---------+-------------------+------------+---------+-----+--------+
10 rows in set (0.00 sec)

mysql> alter table doctor
    -> ;
Query OK, 0 rows affected (0.01 sec)

mysql> add column pgdegree varchar(200);
ERROR 1064 (42000): You have an error in your SQL syntax; check the manual that corresponds to your MySQL server version for the right syntax to use near 'add column pgdegree varchar(200)' at line 1
mysql> alter table doctor
    -> add column pgdegree varchar(200);
Query OK, 0 rows affected (0.03 sec)
Records: 0  Duplicates: 0  Warnings: 0

mysql> desc doctor;
+----------+--------------+------+-----+---------+----------------+
| Field    | Type         | Null | Key | Default | Extra          |
+----------+--------------+------+-----+---------+----------------+
| id       | int          | NO   | PRI | NULL    | auto_increment |
| name     | varchar(200) | NO   |     | NULL    |                |
| email    | varchar(200) | NO   | UNI | NULL    |                |
| contact  | varchar(200) | NO   | UNI | NULL    |                |
| Bdegree  | varchar(200) | NO   |     | NULL    |                |
| age      | int          | NO   |     | NULL    |                |
| salary   | int          | YES  |     | NULL    |                |
| pgdegree | varchar(200) | YES  |     | NULL    |                |
+----------+--------------+------+-----+---------+----------------+
8 rows in set (0.00 sec)

mysql> update into pgdegree('M.D');
ERROR 1064 (42000): You have an error in your SQL syntax; check the manual that corresponds to your MySQL server version for the right syntax to use near 'into pgdegree('M.D')' at line 1
mysql> update doctor set pgdegree='M.D' where id=1;
Query OK, 1 row affected (0.01 sec)
Rows matched: 1  Changed: 1  Warnings: 0

mysql> select * from doctor;
+----+---------+-------------------+------------+---------+-----+--------+----------+
| id | name    | email             | contact    | Bdegree | age | salary | pgdegree |
+----+---------+-------------------+------------+---------+-----+--------+----------+
|  1 | PARAG   | parag@gmail.com   | 6424687248 | MBBS    |  32 |  10000 | M.D      |
|  2 | Anagha  | Anagha@gmail.com  | 6424675248 | BHMS    |  28 |  10000 | NULL     |
|  3 | Rizwan  | Rizwan@gmail.com  | 9824675248 | BAMS    |  35 |  50000 | NULL     |
|  4 | Ishvari | Ishvari@gmail.com | 9824675890 | MBBS    |  34 |  60000 | NULL     |
|  5 | Radhika | Radhika@gmail.com | 9823675890 | MBBS    |  29 |  10000 | NULL     |
|  6 | Yash    | Yash@gmail.com    | 9823675340 | BHMS    |  27 |  10000 | NULL     |
|  7 | Avni    | Avni@gmail.com    | 9813675340 | MBBS    |  33 |  10000 | NULL     |
|  8 | Mahesh  | Mahesh@gmail.com  | 6348934240 | BHMS    |  39 |  70000 | NULL     |
|  9 | Ritika  | Ritika@gmail.com  | 6348934640 | BHMS    |  49 |  30000 | NULL     |
| 10 | Anushka | Anushka@gmail.com | 6348534640 | BHMS    |  26 |  20000 | NULL     |
+----+---------+-------------------+------------+---------+-----+--------+----------+
10 rows in set (0.00 sec)

mysql> update doctor set pgdegree='M.S' where id=2;
Query OK, 1 row affected (0.01 sec)
Rows matched: 1  Changed: 1  Warnings: 0

mysql> update doctor set pgdegree='D.M' where id=3;
Query OK, 1 row affected (0.01 sec)
Rows matched: 1  Changed: 1  Warnings: 0

mysql> update doctor set pgdegree='M.D' where id=4;
Query OK, 1 row affected (0.01 sec)
Rows matched: 1  Changed: 1  Warnings: 0

mysql> update doctor set pgdegree='M.D' where id=5;
Query OK, 1 row affected (0.01 sec)
Rows matched: 1  Changed: 1  Warnings: 0

mysql> update doctor set pgdegree='M.S' where id=6;
Query OK, 1 row affected (0.03 sec)
Rows matched: 1  Changed: 1  Warnings: 0

mysql> update doctor set pgdegree='D.M' where id=7;
Query OK, 1 row affected (0.01 sec)
Rows matched: 1  Changed: 1  Warnings: 0

mysql> update doctor set pgdegree='Mch' where id=8;
Query OK, 1 row affected (0.01 sec)
Rows matched: 1  Changed: 1  Warnings: 0

mysql> update doctor set pgdegree='D.M' where id=9;
Query OK, 1 row affected (0.01 sec)
Rows matched: 1  Changed: 1  Warnings: 0

mysql> update doctor set pgdegree='Mch' where id=10;
Query OK, 1 row affected (0.00 sec)
Rows matched: 1  Changed: 1  Warnings: 0

mysql> select * from doctor;
+----+---------+-------------------+------------+---------+-----+--------+----------+
| id | name    | email             | contact    | Bdegree | age | salary | pgdegree |
+----+---------+-------------------+------------+---------+-----+--------+----------+
|  1 | PARAG   | parag@gmail.com   | 6424687248 | MBBS    |  32 |  10000 | M.D      |
|  2 | Anagha  | Anagha@gmail.com  | 6424675248 | BHMS    |  28 |  10000 | M.S      |
|  3 | Rizwan  | Rizwan@gmail.com  | 9824675248 | BAMS    |  35 |  50000 | D.M      |
|  4 | Ishvari | Ishvari@gmail.com | 9824675890 | MBBS    |  34 |  60000 | M.D      |
|  5 | Radhika | Radhika@gmail.com | 9823675890 | MBBS    |  29 |  10000 | M.D      |
|  6 | Yash    | Yash@gmail.com    | 9823675340 | BHMS    |  27 |  10000 | M.S      |
|  7 | Avni    | Avni@gmail.com    | 9813675340 | MBBS    |  33 |  10000 | D.M      |
|  8 | Mahesh  | Mahesh@gmail.com  | 6348934240 | BHMS    |  39 |  70000 | Mch      |
|  9 | Ritika  | Ritika@gmail.com  | 6348934640 | BHMS    |  49 |  30000 | D.M      |
| 10 | Anushka | Anushka@gmail.com | 6348534640 | BHMS    |  26 |  20000 | Mch      |
+----+---------+-------------------+------------+---------+-----+--------+----------+
10 rows in set (0.00 sec)

mysql> alter table doctor
    -> drop column age;
Query OK, 0 rows affected (0.06 sec)
Records: 0  Duplicates: 0  Warnings: 0

mysql> select * from doctor;
+----+---------+-------------------+------------+---------+--------+----------+
| id | name    | email             | contact    | Bdegree | salary | pgdegree |
+----+---------+-------------------+------------+---------+--------+----------+
|  1 | PARAG   | parag@gmail.com   | 6424687248 | MBBS    |  10000 | M.D      |
|  2 | Anagha  | Anagha@gmail.com  | 6424675248 | BHMS    |  10000 | M.S      |
|  3 | Rizwan  | Rizwan@gmail.com  | 9824675248 | BAMS    |  50000 | D.M      |
|  4 | Ishvari | Ishvari@gmail.com | 9824675890 | MBBS    |  60000 | M.D      |
|  5 | Radhika | Radhika@gmail.com | 9823675890 | MBBS    |  10000 | M.D      |
|  6 | Yash    | Yash@gmail.com    | 9823675340 | BHMS    |  10000 | M.S      |
|  7 | Avni    | Avni@gmail.com    | 9813675340 | MBBS    |  10000 | D.M      |
|  8 | Mahesh  | Mahesh@gmail.com  | 6348934240 | BHMS    |  70000 | Mch      |
|  9 | Ritika  | Ritika@gmail.com  | 6348934640 | BHMS    |  30000 | D.M      |
| 10 | Anushka | Anushka@gmail.com | 6348534640 | BHMS    |  20000 | Mch      |
+----+---------+-------------------+------------+---------+--------+----------+
10 rows in set (0.00 sec)

mysql> alter table doctor
    -> rename column salary to doctor_salary;
Query OK, 0 rows affected (0.03 sec)
Records: 0  Duplicates: 0  Warnings: 0

mysql> select * from doctor;
+----+---------+-------------------+------------+---------+---------------+----------+
| id | name    | email             | contact    | Bdegree | doctor_salary | pgdegree |
+----+---------+-------------------+------------+---------+---------------+----------+
|  1 | PARAG   | parag@gmail.com   | 6424687248 | MBBS    |         10000 | M.D      |
|  2 | Anagha  | Anagha@gmail.com  | 6424675248 | BHMS    |         10000 | M.S      |
|  3 | Rizwan  | Rizwan@gmail.com  | 9824675248 | BAMS    |         50000 | D.M      |
|  4 | Ishvari | Ishvari@gmail.com | 9824675890 | MBBS    |         60000 | M.D      |
|  5 | Radhika | Radhika@gmail.com | 9823675890 | MBBS    |         10000 | M.D      |
|  6 | Yash    | Yash@gmail.com    | 9823675340 | BHMS    |         10000 | M.S      |
|  7 | Avni    | Avni@gmail.com    | 9813675340 | MBBS    |         10000 | D.M      |
|  8 | Mahesh  | Mahesh@gmail.com  | 6348934240 | BHMS    |         70000 | Mch      |
|  9 | Ritika  | Ritika@gmail.com  | 6348934640 | BHMS    |         30000 | D.M      |
| 10 | Anushka | Anushka@gmail.com | 6348534640 | BHMS    |         20000 | Mch      |
+----+---------+-------------------+------------+---------+---------------+----------+
10 rows in set (0.00 sec)

mysql> desc doctor;
+---------------+--------------+------+-----+---------+----------------+
| Field         | Type         | Null | Key | Default | Extra          |
+---------------+--------------+------+-----+---------+----------------+
| id            | int          | NO   | PRI | NULL    | auto_increment |
| name          | varchar(200) | NO   |     | NULL    |                |
| email         | varchar(200) | NO   | UNI | NULL    |                |
| contact       | varchar(200) | NO   | UNI | NULL    |                |
| Bdegree       | varchar(200) | NO   |     | NULL    |                |
| doctor_salary | int          | YES  |     | NULL    |                |
| pgdegree      | varchar(200) | YES  |     | NULL    |                |
+---------------+--------------+------+-----+---------+----------------+
7 rows in set (0.01 sec)

mysql> insert into doctor value('0','Anurag','anurag@gmail.com','8943628690','BHMS',40000,'M.D');
Query OK, 1 row affected (0.01 sec)

mysql> select * from doctor;
+----+---------+-------------------+------------+---------+---------------+----------+
| id | name    | email             | contact    | Bdegree | doctor_salary | pgdegree |
+----+---------+-------------------+------------+---------+---------------+----------+
|  1 | PARAG   | parag@gmail.com   | 6424687248 | MBBS    |         10000 | M.D      |
|  2 | Anagha  | Anagha@gmail.com  | 6424675248 | BHMS    |         10000 | M.S      |
|  3 | Rizwan  | Rizwan@gmail.com  | 9824675248 | BAMS    |         50000 | D.M      |
|  4 | Ishvari | Ishvari@gmail.com | 9824675890 | MBBS    |         60000 | M.D      |
|  5 | Radhika | Radhika@gmail.com | 9823675890 | MBBS    |         10000 | M.D      |
|  6 | Yash    | Yash@gmail.com    | 9823675340 | BHMS    |         10000 | M.S      |
|  7 | Avni    | Avni@gmail.com    | 9813675340 | MBBS    |         10000 | D.M      |
|  8 | Mahesh  | Mahesh@gmail.com  | 6348934240 | BHMS    |         70000 | Mch      |
|  9 | Ritika  | Ritika@gmail.com  | 6348934640 | BHMS    |         30000 | D.M      |
| 10 | Anushka | Anushka@gmail.com | 6348534640 | BHMS    |         20000 | Mch      |
| 11 | Anurag  | anurag@gmail.com  | 8943628690 | BHMS    |         40000 | M.D      |
+----+---------+-------------------+------------+---------+---------------+----------+
11 rows in set (0.00 sec)

mysql> insert into doctor value('0','Parth','parth@gmail.com','8943646690','MBBS',50000,'Mch');
Query OK, 1 row affected (0.01 sec)

mysql> insert into doctor value('0','Jiva','jiva@gmail.com','8945298498','BHMS',35000,'D.M');
Query OK, 1 row affected (0.01 sec)

mysql> insert into doctor value('0','Nandini','nandini@gmail.com','8965298498','BHMS',45000,'M.S');
Query OK, 1 row affected (0.00 sec)

mysql> insert into doctor value('0','Kavya','kavya@gmail.com','8965298428','MBBS',55000,'D.M');
Query OK, 1 row affected (0.01 sec)

mysql> insert into doctor value('0','Rohit','rohit@gmail.com','8965658428','MBBS',60000,'D.M');
Query OK, 1 row affected (0.01 sec)

mysql> insert into doctor value('0','Prajwal','prajwal@gmail.com','8965658420','BHMS',30000,'M.D');
Query OK, 1 row affected (0.01 sec)

mysql> insert into doctor value('0','Karan','karan@gmail.com','6965658420','MBBS',40000,'Mch');
Query OK, 1 row affected (0.01 sec)

mysql> insert into doctor value('0','Akshay','akshay@gmail.com','6995658420','MBBS',80000,'Mch');
Query OK, 1 row affected (0.00 sec)

mysql> insert into doctor value('0','Aman\','aman@gmail.com','6995634520','BHMS',75000,'D.M');
    '> insert into doctor value('0','Aman','aman@gmail.com','6995634520','BHMS',75000,'D.M');
    '> ^C
mysql> insert into doctor value('0','Aman','aman@gmail.com','6995634520','BHMS',75000,'D.M');
Query OK, 1 row affected (0.01 sec)

mysql> select * from doctor;
+----+---------+-------------------+------------+---------+---------------+----------+
| id | name    | email             | contact    | Bdegree | doctor_salary | pgdegree |
+----+---------+-------------------+------------+---------+---------------+----------+
|  1 | PARAG   | parag@gmail.com   | 6424687248 | MBBS    |         10000 | M.D      |
|  2 | Anagha  | Anagha@gmail.com  | 6424675248 | BHMS    |         10000 | M.S      |
|  3 | Rizwan  | Rizwan@gmail.com  | 9824675248 | BAMS    |         50000 | D.M      |
|  4 | Ishvari | Ishvari@gmail.com | 9824675890 | MBBS    |         60000 | M.D      |
|  5 | Radhika | Radhika@gmail.com | 9823675890 | MBBS    |         10000 | M.D      |
|  6 | Yash    | Yash@gmail.com    | 9823675340 | BHMS    |         10000 | M.S      |
|  7 | Avni    | Avni@gmail.com    | 9813675340 | MBBS    |         10000 | D.M      |
|  8 | Mahesh  | Mahesh@gmail.com  | 6348934240 | BHMS    |         70000 | Mch      |
|  9 | Ritika  | Ritika@gmail.com  | 6348934640 | BHMS    |         30000 | D.M      |
| 10 | Anushka | Anushka@gmail.com | 6348534640 | BHMS    |         20000 | Mch      |
| 11 | Anurag  | anurag@gmail.com  | 8943628690 | BHMS    |         40000 | M.D      |
| 12 | Parth   | parth@gmail.com   | 8943646690 | MBBS    |         50000 | Mch      |
| 13 | Jiva    | jiva@gmail.com    | 8945298498 | BHMS    |         35000 | D.M      |
| 14 | Nandini | nandini@gmail.com | 8965298498 | BHMS    |         45000 | M.S      |
| 15 | Kavya   | kavya@gmail.com   | 8965298428 | MBBS    |         55000 | D.M      |
| 16 | Rohit   | rohit@gmail.com   | 8965658428 | MBBS    |         60000 | D.M      |
| 17 | Prajwal | prajwal@gmail.com | 8965658420 | BHMS    |         30000 | M.D      |
| 18 | Karan   | karan@gmail.com   | 6965658420 | MBBS    |         40000 | Mch      |
| 19 | Akshay  | akshay@gmail.com  | 6995658420 | MBBS    |         80000 | Mch      |
| 20 | Aman    | aman@gmail.com    | 6995634520 | BHMS    |         75000 | D.M      |
+----+---------+-------------------+------------+---------+---------------+----------+
20 rows in set (0.00 sec)

mysql> select name from doctor;
+---------+
| name    |
+---------+
| PARAG   |
| Anagha  |
| Rizwan  |
| Ishvari |
| Radhika |
| Yash    |
| Avni    |
| Mahesh  |
| Ritika  |
| Anushka |
| Anurag  |
| Parth   |
| Jiva    |
| Nandini |
| Kavya   |
| Rohit   |
| Prajwal |
| Karan   |
| Akshay  |
| Aman    |
+---------+
20 rows in set (0.00 sec)

mysql> select doctor_salary,count(*) as doctor_count f
rom doctor group by doctor_salary;
+---------------+--------------+
| doctor_salary | doctor_count |
+---------------+--------------+
|         10000 |            5 |
|         50000 |            2 |
|         60000 |            2 |
|         70000 |            1 |
|         30000 |            2 |
|         20000 |            1 |
|         40000 |            2 |
|         35000 |            1 |
|         45000 |            1 |
|         55000 |            1 |
|         80000 |            1 |
|         75000 |            1 |
+---------------+--------------+
12 rows in set (0.01 sec)

mysql> select count(doctor_salary) from doctor;
+----------------------+
| count(doctor_salary) |
+----------------------+
|                   20 |
+----------------------+
1 row in set (0.00 sec)

mysql> insert into doctor value('0','Rushikesh','rushi@gmail.com','6956634520','BHMS',75000,'D.M');
Query OK, 1 row affected (0.01 sec)

mysql> select * from doctor where name is 'R%sh';
ERROR 1064 (42000): You have an error in your SQL syntax; check the manual that corresponds to your MySQL server version for the right syntax to use near ''R%sh'' at line 1
mysql> select * from doctor where name='R%sh';
Empty set (0.00 sec)

mysql> select * from doctor where name like 'R%sh';
+----+-----------+-----------------+------------+---------+---------------+----------+
| id | name      | email           | contact    | Bdegree | doctor_salary | pgdegree |
+----+-----------+-----------------+------------+---------+---------------+----------+
| 21 | Rushikesh | rushi@gmail.com | 6956634520 | BHMS    |         75000 | D.M      |
+----+-----------+-----------------+------------+---------+---------------+----------+
1 row in set (0.01 sec)

mysql> select * from doctor where name like 'R%sh' & length(name)>5;
ERROR 1064 (42000): You have an error in your SQL syntax; check the manual that corresponds to your MySQL server version for the right syntax to use near '& length(name)>5' at line 1
mysql> select * from doctor where name like 'R%sh' & length(name)>5;^C
mysql> ^C
mysql> ^C
mysql> select * from doctor where name like 'R%sh' & length (name) >5;
ERROR 1064 (42000): You have an error in your SQL syntax; check the manual that corresponds to your MySQL server version for the right syntax to use near '& length (name) >5' at line 1
mysql> select * from doctor where name like 'R%sh' and length(name)>5;
+----+-----------+-----------------+------------+---------+---------------+----------+
| id | name      | email           | contact    | Bdegree | doctor_salary | pgdegree |
+----+-----------+-----------------+------------+---------+---------------+----------+
| 21 | Rushikesh | rushi@gmail.com | 6956634520 | BHMS    |         75000 | D.M      |
+----+-----------+-----------------+------------+---------+---------------+----------+
1 row in set (0.00 sec)

mysql> select * from doctor where length(name)>5;
+----+-----------+-------------------+------------+---------+---------------+----------+
| id | name      | email             | contact    | Bdegree | doctor_salary | pgdegree |
+----+-----------+-------------------+------------+---------+---------------+----------+
|  2 | Anagha    | Anagha@gmail.com  | 6424675248 | BHMS    |         10000 | M.S      |
|  3 | Rizwan    | Rizwan@gmail.com  | 9824675248 | BAMS    |         50000 | D.M      |
|  4 | Ishvari   | Ishvari@gmail.com | 9824675890 | MBBS    |         60000 | M.D      |
|  5 | Radhika   | Radhika@gmail.com | 9823675890 | MBBS    |         10000 | M.D      |
|  8 | Mahesh    | Mahesh@gmail.com  | 6348934240 | BHMS    |         70000 | Mch      |
|  9 | Ritika    | Ritika@gmail.com  | 6348934640 | BHMS    |         30000 | D.M      |
| 10 | Anushka   | Anushka@gmail.com | 6348534640 | BHMS    |         20000 | Mch      |
| 11 | Anurag    | anurag@gmail.com  | 8943628690 | BHMS    |         40000 | M.D      |
| 14 | Nandini   | nandini@gmail.com | 8965298498 | BHMS    |         45000 | M.S      |
| 17 | Prajwal   | prajwal@gmail.com | 8965658420 | BHMS    |         30000 | M.D      |
| 19 | Akshay    | akshay@gmail.com  | 6995658420 | MBBS    |         80000 | Mch      |
| 21 | Rushikesh | rushi@gmail.com   | 6956634520 | BHMS    |         75000 | D.M      |
+----+-----------+-------------------+------------+---------+---------------+----------+
12 rows in set (0.00 sec)

mysql> select * from doctor where salary='10000';
ERROR 1054 (42S22): Unknown column 'salary' in 'where clause'
mysql> select * from doctor where doctor_salary='10000';
+----+---------+-------------------+------------+---------+---------------+----------+
| id | name    | email             | contact    | Bdegree | doctor_salary | pgdegree |
+----+---------+-------------------+------------+---------+---------------+----------+
|  1 | PARAG   | parag@gmail.com   | 6424687248 | MBBS    |         10000 | M.D      |
|  2 | Anagha  | Anagha@gmail.com  | 6424675248 | BHMS    |         10000 | M.S      |
|  5 | Radhika | Radhika@gmail.com | 9823675890 | MBBS    |         10000 | M.D      |
|  6 | Yash    | Yash@gmail.com    | 9823675340 | BHMS    |         10000 | M.S      |
|  7 | Avni    | Avni@gmail.com    | 9813675340 | MBBS    |         10000 | D.M      |
+----+---------+-------------------+------------+---------+---------------+----------+
5 rows in set (0.00 sec)

mysql> select * from doctor where doctor_salary='10000','50000','30000','60000';
ERROR 1064 (42000): You have an error in your SQL syntax; check the manual that corresponds to your MySQL server version for the right syntax to use near ','50000','30000','60000'' at line 1
mysql> select * from doctor where doctor_salary=('10000');
+----+---------+-------------------+------------+---------+---------------+----------+
| id | name    | email             | contact    | Bdegree | doctor_salary | pgdegree |
+----+---------+-------------------+------------+---------+---------------+----------+
|  1 | PARAG   | parag@gmail.com   | 6424687248 | MBBS    |         10000 | M.D      |
|  2 | Anagha  | Anagha@gmail.com  | 6424675248 | BHMS    |         10000 | M.S      |
|  5 | Radhika | Radhika@gmail.com | 9823675890 | MBBS    |         10000 | M.D      |
|  6 | Yash    | Yash@gmail.com    | 9823675340 | BHMS    |         10000 | M.S      |
|  7 | Avni    | Avni@gmail.com    | 9813675340 | MBBS    |         10000 | D.M      |
+----+---------+-------------------+------------+---------+---------------+----------+
5 rows in set (0.00 sec)

mysql> select * from doctor where doctor_salary=('10000','50000');
ERROR 1241 (21000): Operand should contain 1 column(s)
mysql> select * from doctor where doctor_salary=('10000'),('50000');
ERROR 1064 (42000): You have an error in your SQL syntax; check the manual that corresponds to your MySQL server version for the right syntax to use near ',('50000')' at line 1
mysql> select * from doctor where doctor_salary=('10000','50000');
ERROR 1241 (21000): Operand should contain 1 column(s)
mysql>
mysql>
mysql>
mysql>
mysql> select * from doctor where doctor_salary in (10000,50000,30000,60000);
+----+---------+-------------------+------------+---------+---------------+----------+
| id | name    | email             | contact    | Bdegree | doctor_salary | pgdegree |
+----+---------+-------------------+------------+---------+---------------+----------+
|  1 | PARAG   | parag@gmail.com   | 6424687248 | MBBS    |         10000 | M.D      |
|  2 | Anagha  | Anagha@gmail.com  | 6424675248 | BHMS    |         10000 | M.S      |
|  3 | Rizwan  | Rizwan@gmail.com  | 9824675248 | BAMS    |         50000 | D.M      |
|  4 | Ishvari | Ishvari@gmail.com | 9824675890 | MBBS    |         60000 | M.D      |
|  5 | Radhika | Radhika@gmail.com | 9823675890 | MBBS    |         10000 | M.D      |
|  6 | Yash    | Yash@gmail.com    | 9823675340 | BHMS    |         10000 | M.S      |
|  7 | Avni    | Avni@gmail.com    | 9813675340 | MBBS    |         10000 | D.M      |
|  9 | Ritika  | Ritika@gmail.com  | 6348934640 | BHMS    |         30000 | D.M      |
| 12 | Parth   | parth@gmail.com   | 8943646690 | MBBS    |         50000 | Mch      |
| 16 | Rohit   | rohit@gmail.com   | 8965658428 | MBBS    |         60000 | D.M      |
| 17 | Prajwal | prajwal@gmail.com | 8965658420 | BHMS    |         30000 | M.D      |
+----+---------+-------------------+------------+---------+---------------+----------+
11 rows in set (0.00 sec)

mysql> select * from doctor where doctor_salary between(10000 to 50000) ;
ERROR 1064 (42000): You have an error in your SQL syntax; check the manual that corresponds to your MySQL server version for the right syntax to use near 'to 50000)' at line 1
mysql> select * from doctor where doctor_salary between(10000^C000) ;
mysql> ^C
mysql> ^C
mysql> select * from doctor where doctor_salary between 10000 and 50000;
+----+---------+-------------------+------------+---------+---------------+----------+
| id | name    | email             | contact    | Bdegree | doctor_salary | pgdegree |
+----+---------+-------------------+------------+---------+---------------+----------+
|  1 | PARAG   | parag@gmail.com   | 6424687248 | MBBS    |         10000 | M.D      |
|  2 | Anagha  | Anagha@gmail.com  | 6424675248 | BHMS    |         10000 | M.S      |
|  3 | Rizwan  | Rizwan@gmail.com  | 9824675248 | BAMS    |         50000 | D.M      |
|  5 | Radhika | Radhika@gmail.com | 9823675890 | MBBS    |         10000 | M.D      |
|  6 | Yash    | Yash@gmail.com    | 9823675340 | BHMS    |         10000 | M.S      |
|  7 | Avni    | Avni@gmail.com    | 9813675340 | MBBS    |         10000 | D.M      |
|  9 | Ritika  | Ritika@gmail.com  | 6348934640 | BHMS    |         30000 | D.M      |
| 10 | Anushka | Anushka@gmail.com | 6348534640 | BHMS    |         20000 | Mch      |
| 11 | Anurag  | anurag@gmail.com  | 8943628690 | BHMS    |         40000 | M.D      |
| 12 | Parth   | parth@gmail.com   | 8943646690 | MBBS    |         50000 | Mch      |
| 13 | Jiva    | jiva@gmail.com    | 8945298498 | BHMS    |         35000 | D.M      |
| 14 | Nandini | nandini@gmail.com | 8965298498 | BHMS    |         45000 | M.S      |
| 17 | Prajwal | prajwal@gmail.com | 8965658420 | BHMS    |         30000 | M.D      |
| 18 | Karan   | karan@gmail.com   | 6965658420 | MBBS    |         40000 | Mch      |
+----+---------+-------------------+------------+---------+---------------+----------+
14 rows in set (0.01 sec)

mysql> select * from doctor max(doctor_salary);
ERROR 1064 (42000): You have an error in your SQL syntax; check the manual that corresponds to your MySQL server version for the right syntax to use near 'max(doctor_salary)' at line 1
mysql> select max(doctor_salary) as max_salary,min(doctor_salary) as min_salary;
ERROR 1054 (42S22): Unknown column 'doctor_salary' in 'field list'
mysql> select max(salary) as max_salary,min(salary) as min_salary;
ERROR 1054 (42S22): Unknown column 'salary' in 'field list'
mysql> select max(doctor_salary) as max_salary,min(doctor_salary) as min_salary;
ERROR 1054 (42S22): Unknown column 'doctor_salary' in 'field list'
mysql> select max(doctor_salary);
ERROR 1054 (42S22): Unknown column 'doctor_salary' in 'field list'
mysql> select max(doctor_salary);
ERROR 1054 (42S22): Unknown column 'doctor_salary' in 'field list'
mysql>
mysql>
mysql>
mysql>
mysql> select MAX(doctor_salary);
ERROR 1054 (42S22): Unknown column 'doctor_salary' in 'field list'
mysql> select MAX('doctor_salary');
+----------------------+
| MAX('doctor_salary') |
+----------------------+
| doctor_salary        |
+----------------------+
1 row in set (0.00 sec)

mysql> select avg(doctor_salary) as average_salary;
ERROR 1054 (42S22): Unknown column 'doctor_salary' in 'field list'
mysql> select avg(doctor_salary) from doctor as average_salary;
+--------------------+
| avg(doctor_salary) |
+--------------------+
|         41190.4762 |
+--------------------+
1 row in set (0.00 sec)

mysql> select max(doctor_salary) from doctor as average_salary;
+--------------------+
| max(doctor_salary) |
+--------------------+
|              80000 |
+--------------------+
1 row in set (0.00 sec)

mysql> select min(doctor_salary) from doctor as average_salary;
+--------------------+
| min(doctor_salary) |
+--------------------+
|              10000 |
+--------------------+
1 row in set (0.00 sec)

mysql> select count(*) as total_doctor from doctor;
+--------------+
| total_doctor |
+--------------+
|           21 |
+--------------+
1 row in set (0.00 sec)

mysql> select count(*) as d_count from doctor where sa
lary=10000;
ERROR 1054 (42S22): Unknown column 'salary' in 'where clause'
mysql> select count(*) as d_count from doctor where doctor_salary=10000;
+---------+
| d_count |
+---------+
|       5 |
+---------+
1 row in set (0.00 sec)

mysql> delete from doctor where doctor_salary>10000;
Query OK, 16 rows affected (0.02 sec)

mysql> select * from doctor;
+----+---------+-------------------+------------+---------+---------------+----------+
| id | name    | email             | contact    | Bdegree | doctor_salary | pgdegree |
+----+---------+-------------------+------------+---------+---------------+----------+
|  1 | PARAG   | parag@gmail.com   | 6424687248 | MBBS    |         10000 | M.D      |
|  2 | Anagha  | Anagha@gmail.com  | 6424675248 | BHMS    |         10000 | M.S      |
|  5 | Radhika | Radhika@gmail.com | 9823675890 | MBBS    |         10000 | M.D      |
|  6 | Yash    | Yash@gmail.com    | 9823675340 | BHMS    |         10000 | M.S      |
|  7 | Avni    | Avni@gmail.com    | 9813675340 | MBBS    |         10000 | D.M      |
+----+---------+-------------------+------------+---------+---------------+----------+
5 rows in set (0.00 sec)

mysql> select * from doctor;
+----+---------+-------------------+------------+---------+---------------+----------+
| id | name    | email             | contact    | Bdegree | doctor_salary | pgdegree |
+----+---------+-------------------+------------+---------+---------------+----------+
|  1 | PARAG   | parag@gmail.com   | 6424687248 | MBBS    |         10000 | M.D      |
|  2 | Anagha  | Anagha@gmail.com  | 6424675248 | BHMS    |         10000 | M.S      |
|  5 | Radhika | Radhika@gmail.com | 9823675890 | MBBS    |         10000 | M.D      |
|  6 | Yash    | Yash@gmail.com    | 9823675340 | BHMS    |         10000 | M.S      |
|  7 | Avni    | Avni@gmail.com    | 9813675340 | MBBS    |         10000 | D.M      |
+----+---------+-------------------+------------+---------+---------------+----------+
5 rows in set (0.00 sec)