
mysql> use revise;
Database changed
mysql> desc employeee;
+--------+-------------+------+-----+---------+-------+
| Field  | Type        | Null | Key | Default | Extra |
+--------+-------------+------+-----+---------+-------+
| id     | int         | YES  |     | NULL    |       |
| name   | varchar(22) | YES  |     | NULL    |       |
| salary | int         | YES  |     | NULL    |       |
+--------+-------------+------+-----+---------+-------+
3 rows in set (0.10 sec)

mysql> alter table employeee add column(contact varchar(200),address varchar(200));
Query OK, 0 rows affected (0.10 sec)
Records: 0  Duplicates: 0  Warnings: 0

mysql> desc employeee;
+---------+--------------+------+-----+---------+-------+
| Field   | Type         | Null | Key | Default | Extra |
+---------+--------------+------+-----+---------+-------+
| id      | int          | YES  |     | NULL    |       |
| name    | varchar(22)  | YES  |     | NULL    |       |
| salary  | int          | YES  |     | NULL    |       |
| contact | varchar(200) | YES  |     | NULL    |       |
| address | varchar(200) | YES  |     | NULL    |       |
+---------+--------------+------+-----+---------+-------+
5 rows in set (0.01 sec)

mysql> alter table employee modify column name varchar(50);
ERROR 1146 (42S02): Table 'revise.employee' doesn't exist
mysql> alter table employeee modify column name varchar(50);
Query OK, 0 rows affected (0.02 sec)
Records: 0  Duplicates: 0  Warnings: 0

mysql> desc employeee;
+---------+--------------+------+-----+---------+-------+
| Field   | Type         | Null | Key | Default | Extra |
+---------+--------------+------+-----+---------+-------+
| id      | int          | YES  |     | NULL    |       |
| name    | varchar(50)  | YES  |     | NULL    |       |
| salary  | int          | YES  |     | NULL    |       |
| contact | varchar(200) | YES  |     | NULL    |       |
| address | varchar(200) | YES  |     | NULL    |       |
+---------+--------------+------+-----+---------+-------+
5 rows in set (0.00 sec)

mysql> alter table employeee rename column name to ename;
Query OK, 0 rows affected (0.02 sec)
Records: 0  Duplicates: 0  Warnings: 0

mysql> desc employeee;
+---------+--------------+------+-----+---------+-------+
| Field   | Type         | Null | Key | Default | Extra |
+---------+--------------+------+-----+---------+-------+
| id      | int          | YES  |     | NULL    |       |
| ename   | varchar(50)  | YES  |     | NULL    |       |
| salary  | int          | YES  |     | NULL    |       |
| contact | varchar(200) | YES  |     | NULL    |       |
| address | varchar(200) | YES  |     | NULL    |       |
+---------+--------------+------+-----+---------+-------+
5 rows in set (0.00 sec)

mysql> drop column address from employeee;
ERROR 1064 (42000): You have an error in your SQL syntax; check the manual that corresponds to your MySQL server version for the right syntax to use near 'column address from employeee' at line 1
mysql> alter table employeee drop column address;
Query OK, 0 rows affected (0.03 sec)
Records: 0  Duplicates: 0  Warnings: 0

mysql> desc employeee;
+---------+--------------+------+-----+---------+-------+
| Field   | Type         | Null | Key | Default | Extra |
+---------+--------------+------+-----+---------+-------+
| id      | int          | YES  |     | NULL    |       |
| ename   | varchar(50)  | YES  |     | NULL    |       |
| salary  | int          | YES  |     | NULL    |       |
| contact | varchar(200) | YES  |     | NULL    |       |
+---------+--------------+------+-----+---------+-------+
4 rows in set (0.00 sec)

mysql> truncate employeee;
Query OK, 0 rows affected (0.04 sec)

mysql> desc employeee;
+---------+--------------+------+-----+---------+-------+
| Field   | Type         | Null | Key | Default | Extra |
+---------+--------------+------+-----+---------+-------+
| id      | int          | YES  |     | NULL    |       |
| ename   | varchar(50)  | YES  |     | NULL    |       |
| salary  | int          | YES  |     | NULL    |       |
| contact | varchar(200) | YES  |     | NULL    |       |
+---------+--------------+------+-----+---------+-------+
4 rows in set (0.00 sec)

mysql> insert into employeee values(1,'ram',20000,'9854894584');
Query OK, 1 row affected (0.01 sec)

mysql> select  from employeee;
ERROR 1064 (42000): You have an error in your SQL syntax; check the manual that corresponds to your MySQL server version for the right syntax to use near 'from employeee' at line 1
mysql> select  *from employeee;
+------+-------+--------+------------+
| id   | ename | salary | contact    |
+------+-------+--------+------------+
|    1 | ram   |  20000 | 9854894584 |
+------+-------+--------+------------+
1 row in set (0.00 sec)

mysql> insert into employeee values(2,'shyam',30000,'4354894584');
Query OK, 1 row affected (0.01 sec)

mysql> insert into employeee values(3,'karam',35000,'43548943584'),(4,'Raj',45000,'9875839534');
Query OK, 2 rows affected (0.01 sec)
Records: 2  Duplicates: 0  Warnings: 0

mysql> select  *from employeee;
+------+-------+--------+-------------+
| id   | ename | salary | contact     |
+------+-------+--------+-------------+
|    1 | ram   |  20000 | 9854894584  |
|    2 | shyam |  30000 | 4354894584  |
|    3 | karam |  35000 | 43548943584 |
|    4 | Raj   |  45000 | 9875839534  |
+------+-------+--------+-------------+
4 rows in set (0.00 sec)

mysql> delete from employeee where id=4;
Query OK, 1 row affected (0.01 sec)

mysql> select  *from employeee;
+------+-------+--------+-------------+
| id   | ename | salary | contact     |
+------+-------+--------+-------------+
|    1 | ram   |  20000 | 9854894584  |
|    2 | shyam |  30000 | 4354894584  |
|    3 | karam |  35000 | 43548943584 |
+------+-------+--------+-------------+
3 rows in set (0.00 sec)

mysql> update employeee set contact='6534745636' where id=2;
Query OK, 1 row affected (0.01 sec)
Rows matched: 1  Changed: 1  Warnings: 0

mysql> select  *from employeee;
+------+-------+--------+-------------+
| id   | ename | salary | contact     |
+------+-------+--------+-------------+
|    1 | ram   |  20000 | 9854894584  |
|    2 | shyam |  30000 | 6534745636  |
|    3 | karam |  35000 | 43548943584 |
+------+-------+--------+-------------+
3 rows in set (0.00 sec)

mysql> update employeee set contact='9534745636' where id=3;
Query OK, 1 row affected (0.01 sec)
Rows matched: 1  Changed: 1  Warnings: 0

mysql> select  *from employeee;
+------+-------+--------+------------+
| id   | ename | salary | contact    |
+------+-------+--------+------------+
|    1 | ram   |  20000 | 9854894584 |
|    2 | shyam |  30000 | 6534745636 |
|    3 | karam |  35000 | 9534745636 |
+------+-------+--------+------------+
3 rows in set (0.00 sec)

mysql> select * from employeee where id=1 and ename='ram';
+------+-------+--------+------------+
| id   | ename | salary | contact    |
+------+-------+--------+------------+
|    1 | ram   |  20000 | 9854894584 |
+------+-------+--------+------------+
1 row in set (0.05 sec)

mysql> select * from employeee where not ename 'ram';
ERROR 1064 (42000): You have an error in your SQL syntax; check the manual that corresponds to your MySQL server version for the right syntax to use near ''ram'' at line 1
mysql> select * from employeee where not ename='ram';
+------+-------+--------+------------+
| id   | ename | salary | contact    |
+------+-------+--------+------------+
|    2 | shyam |  30000 | 6534745636 |
|    3 | karam |  35000 | 9534745636 |
+------+-------+--------+------------+
2 rows in set (0.01 sec)

mysql> select * from employeee where not ename<>'ram';
+------+-------+--------+------------+
| id   | ename | salary | contact    |
+------+-------+--------+------------+
|    1 | ram   |  20000 | 9854894584 |
+------+-------+--------+------------+
1 row in set (0.00 sec)

mysql> select * from employeee where salary>19000 && salary<29000;
+------+-------+--------+------------+
| id   | ename | salary | contact    |
+------+-------+--------+------------+
|    1 | ram   |  20000 | 9854894584 |
+------+-------+--------+------------+
1 row in set, 1 warning (0.01 sec)

mysql> select * from employeee where salary between 19000 and 29000;
+------+-------+--------+------------+
| id   | ename | salary | contact    |
+------+-------+--------+------------+
|    1 | ram   |  20000 | 9854894584 |
+------+-------+--------+------------+
1 row in set (0.01 sec)

mysql> select distinct ename from employeee;
+-------+
| ename |
+-------+
| ram   |
| shyam |
| karam |
+-------+
3 rows in set (0.01 sec)

mysql> select * from employeee where name like '%am';
ERROR 1054 (42S22): Unknown column 'name' in 'where clause'
mysql> select * from employeee where ename like '%am';
+------+-------+--------+------------+
| id   | ename | salary | contact    |
+------+-------+--------+------------+
|    1 | ram   |  20000 | 9854894584 |
|    2 | shyam |  30000 | 6534745636 |
|    3 | karam |  35000 | 9534745636 |
+------+-------+--------+------------+
3 rows in set (0.00 sec)

mysql> select * from employeee where ename like 'r%';
+------+-------+--------+------------+
| id   | ename | salary | contact    |
+------+-------+--------+------------+
|    1 | ram   |  20000 | 9854894584 |
+------+-------+--------+------------+
1 row in set (0.00 sec)

mysql> select * from employeee where ename like 'sh%';
+------+-------+--------+------------+
| id   | ename | salary | contact    |
+------+-------+--------+------------+
|    2 | shyam |  30000 | 6534745636 |
+------+-------+--------+------------+
1 row in set (0.00 sec)

mysql> select * from employeee where ename like 'k%m';
+------+-------+--------+------------+
| id   | ename | salary | contact    |
+------+-------+--------+------------+
|    3 | karam |  35000 | 9534745636 |
+------+-------+--------+------------+
1 row in set (0.00 sec)

mysql> select * from employeee where ename like '---';
Empty set (0.00 sec)

mysql> select * from employeee where ename like '___';
+------+-------+--------+------------+
| id   | ename | salary | contact    |
+------+-------+--------+------------+
|    1 | ram   |  20000 | 9854894584 |
+------+-------+--------+------------+
1 row in set (0.00 sec)

mysql> select * from employeee where ename like '______';
Empty set (0.00 sec)

mysql> select * from employeee where ename like '_____';
+------+-------+--------+------------+
| id   | ename | salary | contact    |
+------+-------+--------+------------+
|    2 | shyam |  30000 | 6534745636 |
|    3 | karam |  35000 | 9534745636 |
+------+-------+--------+------------+
2 rows in set (0.00 sec)

mysql> select count(salary) from employee;
ERROR 1146 (42S02): Table 'revise.employee' doesn't exist
mysql> select count(salary) from employeee;
+---------------+
| count(salary) |
+---------------+
|             3 |
+---------------+
1 row in set (0.01 sec)

mysql> select count(*) from employeee;
+----------+
| count(*) |
+----------+
|        3 |
+----------+
1 row in set (0.03 sec)

mysql> select sum(*) from employeee;
ERROR 1064 (42000): You have an error in your SQL syntax; check the manual that corresponds to your MySQL server version for the right syntax to use near '*) from employeee' at line 1
mysql> select sum(salary) from employeee;
+-------------+
| sum(salary) |
+-------------+
|       85000 |
+-------------+
1 row in set (0.00 sec)

mysql> select avg(salary) from employeee;
+-------------+
| avg(salary) |
+-------------+
|  28333.3333 |
+-------------+
1 row in set (0.00 sec)

mysql> select min(salary) from employeee;
+-------------+
| min(salary) |
+-------------+
|       20000 |
+-------------+
1 row in set (0.00 sec)

mysql> select max(salary) from employeee;
+-------------+
| max(salary) |
+-------------+
|       35000 |
+-------------+
1 row in set (0.00 sec)

mysql> select salary from employeee group by salary;
+--------+
| salary |
+--------+
|  20000 |
|  30000 |
|  35000 |
+--------+
3 rows in set (0.00 sec)

mysql> select * from employeee group by ename;
ERROR 1055 (42000): Expression #1 of SELECT list is not in GROUP BY clause and contains nonaggregated column 'revise.employeee.id' which is not functionally dependent on columns in GROUP BY clause; this is incompatible with sql_mode=only_full_group_by
mysql> select ename from employeee group by ename;
+-------+
| ename |
+-------+
| ram   |
| shyam |
| karam |
+-------+
3 rows in set (0.00 sec)

mysql> select salary,count(salary) from employeee group by salary;
+--------+---------------+
| salary | count(salary) |
+--------+---------------+
|  20000 |             1 |
|  30000 |             1 |
|  35000 |             1 |
+--------+---------------+
3 rows in set (0.00 sec)

mysql> insert int employeee values(4,'kunal',20000,'8427346894');
ERROR 1064 (42000): You have an error in your SQL syntax; check the manual that corresponds to your MySQL server version for the right syntax to use near 'int employeee values(4,'kunal',20000,'8427346894')' at line 1
mysql> insert into employeee values(4,'ram',20000,'9864894584');
Query OK, 1 row affected (0.02 sec)

mysql> select * from employeee;
+------+-------+--------+------------+
| id   | ename | salary | contact    |
+------+-------+--------+------------+
|    1 | ram   |  20000 | 9854894584 |
|    2 | shyam |  30000 | 6534745636 |
|    3 | karam |  35000 | 9534745636 |
|    4 | ram   |  20000 | 9864894584 |
+------+-------+--------+------------+
4 rows in set (0.00 sec)

mysql> select salary,count(salary) from employeee group by salary;
+--------+---------------+
| salary | count(salary) |
+--------+---------------+
|  20000 |             2 |
|  30000 |             1 |
|  35000 |             1 |
+--------+---------------+
3 rows in set (0.00 sec)

mysql> select *,count(ename) from employeee group by ename;
ERROR 1055 (42000): Expression #1 of SELECT list is not in GROUP BY clause and contains nonaggregated column 'revise.employeee.id' which is not functionally dependent on columns in GROUP BY clause; this is incompatible with sql_mode=only_full_group_by
mysql> select ename,count(ename) from employeee group by ename;
+-------+--------------+
| ename | count(ename) |
+-------+--------------+
| ram   |            2 |
| shyam |            1 |
| karam |            1 |
+-------+--------------+
3 rows in set (0.00 sec)

mysql> select salary,count(salary) from employeee group by salary having count(salary)>1;
+--------+---------------+
| salary | count(salary) |
+--------+---------------+
|  20000 |             2 |
+--------+---------------+
1 row in set (0.01 sec)

mysql> select salary,count (salary) from employeee group by salary having co
unt(salary)=1;
ERROR 1630 (42000): FUNCTION revise.count does not exist. Check the 'Function Name Parsing and Resolution' section in the Reference Manual
mysql> select salary,count(salary) from employeee group by salary having cou
nt(salary)=1;
+--------+---------------+
| salary | count(salary) |
+--------+---------------+
|  30000 |             1 |
|  35000 |             1 |
+--------+---------------+
2 rows in set (0.01 sec)

mysql> select salary,count(salary) from employeee group by salary having cou
nt(salary)=1;
+--------+---------------+
| salary | count(salary) |
+--------+---------------+
|  30000 |             1 |
|  35000 |             1 |
+--------+---------------+
2 rows in set (0.01 sec)

mysql> select salary,count(salary) from employeee group by salary having count(salary)=2\;
ERROR:
Unknown command '\;'.
    -> ;
ERROR 1064 (42000): You have an error in your SQL syntax; check the manual that corresponds to your MySQL server version for the right syntax to use near '\' at line 1
mysql> select salary,count(salary) from employeee group by salary having count(salary)=2;
+--------+---------------+
| salary | count(salary) |
+--------+---------------+
|  20000 |             2 |
+--------+---------------+
1 row in set (0.00 sec)

mysql> select salary,count(salary) from employeee where ename like 'r%' grou
p by salary having count(salary)>=1 order by desc;
ERROR 1064 (42000): You have an error in your SQL syntax; check the manual that corresponds to your MySQL server version for the right syntax to use near 'desc' at line 1
mysql> select salary,count(salary) from employeee where ename like 'r%' group by salary having count(salary)>=1 order by salary desc;
+--------+---------------+
| salary | count(salary) |
+--------+---------------+
|  20000 |             2 |
+--------+---------------+
1 row in set (0.02 sec)

mysql> select salary,count(salary) from employeee where ename like '%m' grou
p by salary having count(salary)>=1 order by salary desc;
+--------+---------------+
| salary | count(salary) |
+--------+---------------+
|  35000 |             1 |
|  30000 |             1 |
|  20000 |             2 |
+--------+---------------+
3 rows in set (0.00 sec)

mysql> create table employee (id int(2),name varchar(200) not null,sal int(5));
Query OK, 0 rows affected, 2 warnings (0.15 sec)

mysql> desc employee;
+-------+--------------+------+-----+---------+-------+
| Field | Type         | Null | Key | Default | Extra |
+-------+--------------+------+-----+---------+-------+
| id    | int          | YES  |     | NULL    |       |
| name  | varchar(200) | NO   |     | NULL    |       |
| sal   | int          | YES  |     | NULL    |       |
+-------+--------------+------+-----+---------+-------+
3 rows in set (0.04 sec)

mysql> drop table employee;
Query OK, 0 rows affected (0.05 sec)

mysql> create table employee (id int(2),name varchar(200) not null unique,sa
l int(5));
Query OK, 0 rows affected, 2 warnings (0.03 sec)

mysql> desc employee;
+-------+--------------+------+-----+---------+-------+
| Field | Type         | Null | Key | Default | Extra |
+-------+--------------+------+-----+---------+-------+
| id    | int          | YES  |     | NULL    |       |
| name  | varchar(200) | NO   | PRI | NULL    |       |
| sal   | int          | YES  |     | NULL    |       |
+-------+--------------+------+-----+---------+-------+
3 rows in set (0.01 sec)

mysql> drop table employee;
Query OK, 0 rows affected (0.07 sec)

mysql> create table employee (id int(2) primary key auto_increment,name varc
har(200) not null unique,sal int(5));
Query OK, 0 rows affected, 2 warnings (0.06 sec)

mysql> desc employee;
+-------+--------------+------+-----+---------+----------------+
| Field | Type         | Null | Key | Default | Extra          |
+-------+--------------+------+-----+---------+----------------+
| id    | int          | NO   | PRI | NULL    | auto_increment |
| name  | varchar(200) | NO   | UNI | NULL    |                |
| sal   | int          | YES  |     | NULL    |                |
+-------+--------------+------+-----+---------+----------------+
3 rows in set (0.01 sec)

mysql> create table company(compid int(2) primary key auto_increment,compnam
e varchar(200),contact varchar(200) not null unique,id int(3),foreign key(id) references employee(id));
Query OK, 0 rows affected, 2 warnings (0.07 sec)

mysql> desc employee;
+-------+--------------+------+-----+---------+----------------+
| Field | Type         | Null | Key | Default | Extra          |
+-------+--------------+------+-----+---------+----------------+
| id    | int          | NO   | PRI | NULL    | auto_increment |
| name  | varchar(200) | NO   | UNI | NULL    |                |
| sal   | int          | YES  |     | NULL    |                |
+-------+--------------+------+-----+---------+----------------+
3 rows in set (0.00 sec)

mysql> desc company;
+----------+--------------+------+-----+---------+----------------+
| Field    | Type         | Null | Key | Default | Extra          |
+----------+--------------+------+-----+---------+----------------+
| compid   | int          | NO   | PRI | NULL    | auto_increment |
| compname | varchar(200) | YES  |     | NULL    |                |
| contact  | varchar(200) | NO   | UNI | NULL    |                |
| id       | int          | YES  | MUL | NULL    |                |
+----------+--------------+------+-----+---------+----------------+
4 rows in set (0.00 sec)

mysql> INSERT INTO employee (name, sal) VALUES
    -> ('John Doe', 50000),
    -> ('Jane Smith', 60000),
    -> ('Alice Johnson', 55000),
    -> ('Bob Brown', 45000),
    -> ('Charlie Davis', 70000);
Query OK, 5 rows affected (0.04 sec)
Records: 5  Duplicates: 0  Warnings: 0

mysql> INSERT INTO company (compname, contact, id) VALUES
    -> ('TechCorp', 'techcorp@example.com', 1),
    -> ('InnovateX', 'innovatex@example.com', 2),
    -> ('SoftSolutions', 'softsolutions@example.com', 3),
    -> ('BuildIt', 'buildit@example.com', 4),
    -> ('DataMinds', 'dataminds@example.com', 5);
Query OK, 5 rows affected (0.01 sec)
Records: 5  Duplicates: 0  Warnings: 0

mysql> select * from employee;
+----+---------------+-------+
| id | name          | sal   |
+----+---------------+-------+
|  1 | John Doe      | 50000 |
|  2 | Jane Smith    | 60000 |
|  3 | Alice Johnson | 55000 |
|  4 | Bob Brown     | 45000 |
|  5 | Charlie Davis | 70000 |
+----+---------------+-------+
5 rows in set (0.00 sec)

mysql> select * from company;
+--------+---------------+---------------------------+------+
| compid | compname      | contact                   | id   |
+--------+---------------+---------------------------+------+
|      1 | TechCorp      | techcorp@example.com      |    1 |
|      2 | InnovateX     | innovatex@example.com     |    2 |
|      3 | SoftSolutions | softsolutions@example.com |    3 |
|      4 | BuildIt       | buildit@example.com       |    4 |
|      5 | DataMinds     | dataminds@example.com     |    5 |
+--------+---------------+---------------------------+------+
5 rows in set (0.00 sec)

mysql> create table company(compid int(2) primary key auto_increment,compname varchar(200),contact varchar(200) not null unique,id int(3),foreign key(id) references employee(id) on delete cascade);
ERROR 1050 (42S01): Table 'company' already exists
mysql> create table companys(compid int(2) primary key auto_increment,compname varchar(200),contact varchar(200) not null unique,id int(3),foreign key(id) references employee(id) on delete cascade);
Query OK, 0 rows affected, 2 warnings (0.07 sec)

mysql> select * from companys;
Empty set (0.00 sec)

mysql> select e.id,c.compid from employee em inner join company cm on e.id=c
.compid;
ERROR 1054 (42S22): Unknown column 'e.id' in 'field list'
mysql> select id,c.compid from employee em inner join company cm on e.id=c.c
ompid;
ERROR 1052 (23000): Column 'id' in field list is ambiguous
mysql> select e.id,c.compid from employee e inner join company c on e.id=c.c
ompid;
+----+--------+
| id | compid |
+----+--------+
|  3 |      3 |
|  4 |      4 |
|  5 |      5 |
|  2 |      2 |
|  1 |      1 |
+----+--------+
5 rows in set (0.00 sec)

mysql> select *from employee;
+----+---------------+-------+
| id | name          | sal   |
+----+---------------+-------+
|  1 | John Doe      | 50000 |
|  2 | Jane Smith    | 60000 |
|  3 | Alice Johnson | 55000 |
|  4 | Bob Brown     | 45000 |
|  5 | Charlie Davis | 70000 |
+----+---------------+-------+
5 rows in set (0.00 sec)

mysql> select * from company;
+--------+---------------+---------------------------+------+
| compid | compname      | contact                   | id   |
+--------+---------------+---------------------------+------+
|      1 | TechCorp      | techcorp@example.com      |    1 |
|      2 | InnovateX     | innovatex@example.com     |    2 |
|      3 | SoftSolutions | softsolutions@example.com |    3 |
|      4 | BuildIt       | buildit@example.com       |    4 |
|      5 | DataMinds     | dataminds@example.com     |    5 |
+--------+---------------+---------------------------+------+
5 rows in set (0.01 sec)

mysql> delimiter //
mysql> select * from company //
+--------+---------------+---------------------------+------+
| compid | compname      | contact                   | id   |
+--------+---------------+---------------------------+------+
|      1 | TechCorp      | techcorp@example.com      |    1 |
|      2 | InnovateX     | innovatex@example.com     |    2 |
|      3 | SoftSolutions | softsolutions@example.com |    3 |
|      4 | BuildIt       | buildit@example.com       |    4 |
|      5 | DataMinds     | dataminds@example.com     |    5 |
+--------+---------------+---------------------------+------+
5 rows in set (0.00 sec)

mysql> delimiter //
mysql> create procedure saveCourse(cid int(3),cname varchar(200)) //
ERROR 1064 (42000): You have an error in your SQL syntax; check the manual that corresponds to your MySQL server version for the right syntax to use near '' at line 1
mysql> create procedure saveCourse(cid int(3),cname varchar(200))
    -> begin
    -> insert into saveCourse values(1,'TCS'),(2,'WIPRO'),(3,'CAPGEMINI')
    -> end
    -> delimiter //
ERROR 1064 (42000): You have an error in your SQL syntax; check the manual that corresponds to your MySQL server version for the right syntax to use near 'end
delimiter' at line 4
mysql> create procedure saveCourse(cid int(3),cname varchar(200))
    -> begin
    -> insert into saveCourse values(1,'TCS'),(2,'WIPRO'),(3,'CAPGEMINI')
    -> end
    -> //
ERROR 1064 (42000): You have an error in your SQL syntax; check the manual that corresponds to your MySQL server version for the right syntax to use near 'end' at line 4
mysql> create procedure saveCourse(cid int(3),cname varchar(200))
    -> begin
    -> insert into saveCourse values(1,'TCS'),(2,'WIPRO'),(3,'CAPGEMINI');
    -> end
    -> //
Query OK, 0 rows affected, 1 warning (0.04 sec)

mysql> select * from saveCourse//
ERROR 1146 (42S02): Table 'revise.savecourse' doesn't exist
mysql> select * from saveCourse
    -> //
ERROR 1146 (42S02): Table 'revise.savecourse' doesn't exist
mysql> create procedure saveCourse(cid int(3),cname varchar(200))
    -> begin
    -> insert into saveCourse values(cid,cname);
    -> end
    -> //
ERROR 1304 (42000): PROCEDURE saveCourse already exists
mysql> create procedures saveCourse(cid int(3),cname varchar(200))
    -> begin
    -> insert into saveCourse values(cid,cname);
    -> end
    -> //
ERROR 1064 (42000): You have an error in your SQL syntax; check the manual that corresponds to your MySQL server version for the right syntax to use near 'procedures saveCourse(cid int(3),cname varchar(200))
begin
insert into saveCour' at line 1
mysql> create procedures saveCourse(cid int(3),cname varchar(200))
    -> begin
    -> insert into employee values(cid,cname);
    -> end
    -> //
ERROR 1064 (42000): You have an error in your SQL syntax; check the manual that corresponds to your MySQL server version for the right syntax to use near 'procedures saveCourse(cid int(3),cname varchar(200))
begin
insert into employee' at line 1
mysql> call saveCourse(1,'java')
    -> //
ERROR 1146 (42S02): Table 'revise.savecourse' doesn't exist
mysql> create procedure saveCourse(cid int(3),cname varchar(200))
    -> begin
    -> insert into saveCourse values(cid,cname);^C
mysql>
mysql>
mysql>
mysql> create procedure saveCourses(cid int(3),cname varchar(200))
    -> begin
    -> insert into employee values(cid,cname);
    -> end
    -> //
Query OK, 0 rows affected, 1 warning (0.01 sec)

mysql> call saveCourses(1,'TCS'),(2,'WIPRO'),(3,'TECH MAHINDRA')
    -> //
ERROR 1064 (42000): You have an error in your SQL syntax; check the manual that corresponds to your MySQL server version for the right syntax to use near ',(2,'WIPRO'),(3,'TECH MAHINDRA')' at line 1
mysql> delimiter ;
mysql> call saveCourses(1,'TCS'),(2,'WIPRO'),(3,'TECH MAHINDRA');
ERROR 1064 (42000): You have an error in your SQL syntax; check the manual that corresponds to your MySQL server version for the right syntax to use near ',(2,'WIPRO'),(3,'TECH MAHINDRA')' at line 1
mysql> call saveCourses(1,'TCS');
ERROR 1136 (21S01): Column count doesn't match value count at row 1
mysql>


